{
  "schema_version": 1,
  "id": "compat:unrewound-tape-fee--employee-fee-policy",
  "game_build": "23896268",
  "matches": [
    {
      "package_id": "nexus:unrewound-tape-fee",
      "sha256": "8be6b46d8dea03e38794fe37c9c44daf1229518b44299ddcbd78dd40473c7504"
    },
    {
      "package_id": "nexus:employee-fee-policy",
      "sha256": "bc4e67959f9ef9220eb5fb2c981e0669fde3b75c08d354200c4465c5ee19cfce"
    }
  ],
  "operations": [
    {
      "type": "replace_with_combined",
      "remove_package_ids": [
        "nexus:unrewound-tape-fee",
        "nexus:employee-fee-policy"
      ],
      "combined_package_id": "nexus:unrewound-tape-fee-employee-fee-policy",
      "combined_sha256": "8a151b1f80c6e43444e303711fb5470058875a7816dd141864452a1d73ad47d9"
    }
  ],
  "verification": {
    "offline": [
      "Verify all three RRMM bundle hashes and embedded manifests",
      "Verify the combined PAK preserves the guarded Unrewound Tape Fee and Employee Fee Policy patches",
      "Verify all ten merged localization resources and exact cooked-package membership"
    ],
    "in_game": [
      "Exercise standalone and mixed rewind, late, and damaged fee records on build 23896268",
      "Verify Employee Fee Policy behavior, the two-dollar rewind row, save and reload, and Brazilian Portuguese text",
      "Verify the automated Faster Returns scan workflow remains functional"
    ]
  }
}
